{
  "$schema": "https://json-schema.org/draft/2020-12/schema",
  "title": "CKB Source", "type": "object",
  "required": ["source_id", "name", "source_type", "url"],
  "properties": {"source_id": {"type": "string"}, "name": {"type": "string"}, "source_type": {"type": "string"}, "url": {"type": "string"}, "priority": {"type": "string"}, "rights_status": {"type": "string"}}
}
